[
  {
    "slug": "american-township",
    "date": "2024-11-25",
    "kind": "minutes",
    "summary": "American Township Trustees held a regular session at which Zoning Inspector Bishop presented a Conditional Use Permit application (Case # BZA2024-12) filed on November 14, 2024, by Cindy Leis of AEDG on behalf of Project BOSC (c/o Jill Tangeman, Esq., Vorys, Sater, Seymour and Pease LLP), seeking to use 162.5 acres off Cole Street for a hyperscale data center complex — including three data center units, a main office building, security office, mounding areas, two water basins, and an AEP substation — on land owned by Neff Farms LLC and currently zoned M-2 Manufacturing. Numerous residents raised concerns about transparency, public participation rights, noise, flooding, and whether the proposed use is legally compatible with the M-2 zoning designation. The Board of Zoning Appeals was scheduled to hold a public hearing on December 11, 2024, to discuss and vote on the conditional use permit.",
    "corridor_relevance": "This meeting directly concerns Project BOSC, the codename for the hyperscale data center development, as the trustees received, discussed, and referred to the Board of Zoning Appeals a Conditional Use Permit application filed by Project BOSC c/o Jill Tangeman, Esq. for construction of data centers on 162.5 acres in American Township.",
    "decisions": [
      "Motion by Trustee Basinger, second by Trustee Mohler to accept the minutes of the November 11, 2024 meeting as presented. Roll call, all yes.",
      "Motion by Trustee Mohler, second by Trustee Basinger to approve payment of the warrants as presented by the Fiscal Officer. Roll call, all yes.",
      "Motion by Trustee Mohler, second by Trustee Basinger to cancel the December 30th meeting and to set 1/2/25 at 4 pm for the reorganization meeting for the new calendar year 2025. Roll call, all yes.",
      "Motion by Trustee Mohler, second by Trustee Harmon to adjourn. Roll call, all yes.",
      "Zoning Board of Appeals scheduled to hold a public hearing on 12/11/24 at 7pm to discuss and vote on the conditional use permit (Case # BZA2024-12).",
      "Legal Counsel Huffman to look into whether trustees may have a right to vote on allowing the conditional use permit to pass or not, and report back to the trustees as soon as possible."
    ],
    "parties": [
      "Paul Basinger, Trustee / Chairman",
      "Ross Harmon, Trustee",
      "Lynn Mohler, Trustee",
      "Brady Overholt, Fiscal Officer",
      "Chief Haines (ATPD)",
      "Chief Hadding (ATFD)",
      "Legal Counsel Huffman",
      "Zoning Inspector Bishop",
      "Cindy Leis, AEDG (Lima Economic Development Group)",
      "Project BOSC",
      "Jill Tangeman, Esq., Vorys, Sater, Seymour and Pease LLP, 52 East Gay Street, Columbus, Ohio",
      "Neff Farms LLC, 11951 Zerkle Road, Lima, Ohio 45806",
      "Midwest Electric",
      "Moose Lodge",
      "Alexander and Bebout",
      "Jonathan Sickles",
      "Tim Piper, 1337 Berry Rd.",
      "Becky Streeter, 1640 W State Rd.",
      "Mike Shrider, 1357 Irvin Rd.",
      "Bob Morris, 3471 Providence Circle",
      "Shelly Reiff, 2470 Irving Rd.",
      "Jeff and Cindy Davis, 3554 Cole",
      "Derek Edwards, 2340 Irving Rd.",
      "John Groom, 1095 W Bluelick",
      "Joe Davis, 1194 W Bluelick",
      "Dave Streeter, 1640 W State Rd.",
      "Denny Schwinnen (Board of Zoning Appeals, Chairman)",
      "Tim Piper (Board of Zoning Appeals member)",
      "Jack Burklo (Board of Zoning Appeals member)",
      "Louis Carter (Board of Zoning Appeals member)",
      "Dan Finch (Board of Zoning Appeals member)",
      "Churchill Construction Company (historical reference)",
      "Mr. Joseph Weir (historical reference)",
      "Trustees Crider, Bowers, and Metzger (historical reference)",
      "AEP"
    ],
    "parcels": [
      "36-1200-02-001.000 (No. 1 – 25 Acres)",
      "36-1200-02-001.001 (No. 2 – 137.5 Acres)",
      "162.5 Acres Combined, N. Cole Street, Lima, Ohio 45801, Section 12, American Township, Ohio"
    ],
    "dollar_figures": [
      "$1000 (Midwest Electric donation for MARCS radios systems to ATPD)",
      "$10,967.77 (Moose Lodge donation to ATFD)",
      "$500 (check #2 from Jonathan Sickles towards debt owed to the township)"
    ],
    "hits": [
      "amazon",
      "bosc",
      "datacenter",
      "easement",
      "rezoning",
      "setback",
      "tax_abatement"
    ],
    "citation": {
      "source": "11-25-24 minutes.docx",
      "source_kind": "document",
      "page": null,
      "confidence": "medium",
      "note": null,
      "verified": true
    }
  },
  {
    "slug": "american-township",
    "date": "2024-12-09",
    "kind": "minutes",
    "summary": "At the American Township Trustees regular meeting, multiple residents addressed the board during privilege of the floor to voice concerns about a proposed data center project, citing issues including noise, flooding, stress impacts, and lack of township noise ordinances. Zoning Inspector Bishop provided context on zoning regulations and explained that a public Board of Zoning Appeals hearing was scheduled for December 11, 2024 at 7pm. Legal Counsel Huffman clarified that the Trustees are legally prohibited from attempting to influence the Board of Zoning Appeals on the matter.",
    "corridor_relevance": "This meeting connects to the data-center corridor project through extensive public comment from neighboring residents opposing a proposed data center, and through Zoning Inspector Bishop's explanation of the upcoming Board of Zoning Appeals hearing on December 11, 2024 that will address the project's zoning matters.",
    "decisions": [
      "Motion by Trustee Harmon second by Trustee Mohler to approve the minutes of the November 25, 2024 meeting as presented. Roll call, all yes.",
      "Motion by Trustee Basinger second by Trustee Harmon to approve payment of the warrants as presented by the Fiscal Officer. Roll call, all yes.",
      "Motion by Trustee Basinger second by Trustee Mohler to accept the reports as presented. Roll call, all yes.",
      "Motion by Trustee Harmon second by Trustee Mohler to name LACRPC as the Metropolitan Planning Organization for American Township for 2025. Roll call, all yes.",
      "Motion by Trustee Mohler second by Trustee Basinger to pay the member dues for the trustees, fiscal officer, and board members for the upcoming year. Roll call, all yes.",
      "Motion by Trustee Mohler second by Trustee Harmon to continue to contract for the Township's MCO; continue to meet on the 2nd and last Monday of each month at 7:30pm; authorize expenditures from Township funds for medical, dental, life, cancer, and intensive care insurance for elected officials and full time workers; offer cash in lieu of benefits up to 25% of total cost; pay Township officials in 12 equal installments on a salary basis; appoint the Fiscal Officer and the Chairman to the Audit/Records Commission; pay Township Trustees and Fiscal Officer state convention fees and expenses; continue with sick, vacation, and comp time policies; appoint the chairman as representative for CDL drug testing program. Roll call, all yes.",
      "Motion by Trustee Basinger second by Trustee Mohler to renew the bonds for the trustees and the fiscal officer through OTARMA. Roll call, all yes.",
      "Motion by Trustee Harmon second by Trustee Basinger to accept Ralph Long, Ron Patterson and Kevin Weiging as seasonal snow plow operators for 2024-25 at a rate of $150/day. Roll call, all yes.",
      "Motion by Trustee Basinger second by Trustee Harmon to accept the donation from the Lima Eagles for MARCS Radios for ATPD in the amount of $3618.62. Roll call, all yes.",
      "Motion by Trustee Mohler second by Trustee Harmon to go into executive session for employee benefits.",
      "Motion by Trustee Mohler second by Trustee [unnamed] to enter an agreement with Aetna Health Insurance and Delta Dental through Stolly Insurance Services as the Township's Broker for 2025 American Township Health Insurance Providers. Roll call, all yes.",
      "Motion by Trustee Basinger second by Trustee Harmon to adjourn. Roll call, all yes."
    ],
    "parties": [
      "Paul Basinger (Trustee/Chairman)",
      "Ross Harmon (Trustee)",
      "Lynn Mohler (Trustee)",
      "Brady Overholt (Fiscal Officer)",
      "Road Superintendent Osting",
      "Ron Patterson",
      "Kevin Weiging",
      "Ralph Long",
      "Police Chief Haines",
      "Lima Eagles",
      "Fire Chief Hadding",
      "Michael Carl",
      "State of Ohio",
      "Zoning Inspector Bishop",
      "Becky Streeter",
      "Dave Streeter",
      "Cindy Davis",
      "Darlene White",
      "Don Morris",
      "Jeff Reprogie",
      "Hunter Reprogie",
      "Mike Shrider",
      "Tim Piper",
      "John Groom",
      "Legal Counsel Huffman",
      "Aetna Health Insurance",
      "Delta Dental",
      "Stolly Insurance Services",
      "Jordan Martin",
      "LACRPC",
      "OTARMA",
      "AEDG"
    ],
    "parcels": [
      "1640 W State Rd.",
      "3554 Cole St.",
      "4848 N Cole St.",
      "3471 Providence Circle",
      "4255 N Cole St.",
      "1357 Irvin Rd.",
      "1337 Berry Rd.",
      "1095 W Bluelick"
    ],
    "dollar_figures": [
      "$150/day (seasonal snow plow operators)",
      "$3618.62 (donation from Lima Eagles for MARCS Radios)",
      "$46,717.98 (grant from State of Ohio for ATFD MARCS Radio systems)",
      "33% decrease from 2024 rates (Aetna/Delta Dental health and dental insurance plan)"
    ],
    "hits": [
      "datacenter",
      "rezoning"
    ],
    "citation": {
      "source": "12-9-24 minutes.docx",
      "source_kind": "document",
      "page": null,
      "confidence": "medium",
      "note": null,
      "verified": true
    }
  }
]
